[
	{
		"id": 1,
		"date": "06/10/2025",
		"name": "William Hatcher",
		"certification": "CCNA",
		"link": "https://www.linkedin.com/posts/austinglander_ccna-networking-cybersecurity-activity-7340059706389950464-c_iV?utm_source=share&utm_medium=member_desktop&rcm=ACoAAD8ljuIBcVFIVknia2DrlCMHKWZ27hYyzZI"
	},
	{
		"id": 2,
		"date": "06/11/2025",
		"name": "Caleb Hyer",
		"certification": "CCNA",
		"link": "https://www.linkedin.com/posts/austinglander_im-happy-to-share-that-ive-obtained-a-new-activity-7340564373913903106-IMTD?utm_source=share&utm_medium=member_desktop&rcm=ACoAAD8ljuIBcVFIVknia2DrlCMHKWZ27hYyzZI"
	},
	{
		"id": 3,
		"date": "08/16/2025",
		"name": "Andrew Marshall",
		"certification": "CCNA",
		"link": "https://www.linkedin.com/posts/austinglander_super-excited-to-announce-that-i-recently-activity-7364422932405604353-WpzX?utm_source=share&utm_medium=member_desktop&rcm=ACoAAD8ljuIBcVFIVknia2DrlCMHKWZ27hYyzZI"
	},
	{
		"id": 4,
		"date": "08/22/2025",
		"name": "Eric Zhang",
		"certification": "CCNA",
		"link": "https://www.linkedin.com/posts/austinglander_im-thrilled-to-share-that-ive-officially-activity-7367217449475190785-9zLo?utm_source=share&utm_medium=member_desktop&rcm=ACoAAD8ljuIBcVFIVknia2DrlCMHKWZ27hYyzZI"
	}
]
